{
    "$schema":  "./modpack.schema.json",
    "schemaVersion":  1,
    "package":  {
                    "id":  "project-zomboid-build",
                    "name":  "Project Zomboid Friends Build",
                    "version":  "0.11.2",
                    "description":  "Portable client package for a four-player modded Project Zomboid server."
                },
    "compatibility":  {
                          "game":  "Project Zomboid",
                          "targetBuild":  "Build 42",
                          "exactGameVersion":  "42.20.3",
                          "steamBuildId":  "24909800",
                          "playerCount":  4,
                          "serverMode":  "hosted"
                      },
    "workshop":  {
                     "collectionUrl":  "",
                     "revision":  "sha256:4f8e3058524dec4ffbfb1f99e674f20fae972423025b139a597e6aba4a3848e0",
                     "itemIds":  [
                                     "3619862853",
                                     "3119788162",
                                     "2463499011",
                                     "3773972040",
                                     "2335368829",
                                     "3736154771",
                                     "3666137359",
                                     "3736155379",
                                     "3565649631",
                                     "3504080284",
                                     "3576150391",
                                     "3666180085",
                                     "3542039112",
                                     "2837923608",
                                     "3537326669",
                                     "3728357493",
                                     "3543229299",
                                     "3484263516",
                                     "3618427553",
                                     "3622163276",
                                     "3614959302",
                                     "3494374578",
                                     "3772052709",
                                     "3773911887",
                                     "3171167894",
                                     "3478633453",
                                     "3005903549",
                                     "3447272250",
                                     "3631989559",
                                     "2937786633",
                                     "3670063857",
                                     "3743371090",
                                     "3161951724",
                                     "3730833846",
                                     "2799152995",
                                     "3726526329",
                                     "3379334330",
                                     "3409287192",
                                     "2805630347",
                                     "3413704851",
                                     "3614034284",
                                     "2566953935",
                                     "3196180339",
                                     "3110911330",
                                     "3779315249",
                                     "3570973322",
                                     "2932549988",
                                     "3292659291",
                                     "2952802178",
                                     "2942793445",
                                     "3539691958",
                                     "3008795514",
                                     "3770890864",
                                     "2642541073",
                                     "2962175696",
                                     "3152529790",
                                     "2969343830",
                                     "3073430075",
                                     "3001592312",
                                     "3647735736",
                                     "1539281445",
                                     "3670064951",
                                     "3330403100",
                                     "3501800585",
                                     "3402491515",
                                     "3409472393",
                                     "3403490889",
                                     "3304582091",
                                     "3469940015",
                                     "3281755175",
                                     "3775549570",
                                     "3268487204",
                                     "3469292499",
                                     "3776182375",
                                     "3461263912",
                                     "3723749278",
                                     "3780683663",
                                     "3771638611",
                                     "3618557184",
                                     "3729411754",
                                     "3784951301",
                                     "2553809727",
                                     "2710167561",
                                     "3779201168",
                                     "3423660713",
                                     "3390897023",
                                     "3739168410",
                                     "3710281407",
                                     "3776262249",
                                     "2879960936",
                                     "3770149036",
                                     "3753700423",
                                     "3753555791",
                                     "3704055215",
                                     "3378285185",
                                     "3693258802",
                                     "3746603021",
                                     "3751199292",
                                     "3768669395",
                                     "3571222611",
                                     "3737772445",
                                     "3749844752",
                                     "3624971238",
                                     "3436499337",
                                     "3776502124",
                                     "3776274080",
                                     "3610005735",
                                     "3616176188",
                                     "3412105017",
                                     "3776164832",
                                     "2713921292",
                                     "3401134276",
                                     "3728775267",
                                     "3639628777",
                                     "3781616141",
                                     "3749026793",
                                     "3745718141",
                                     "3464606086",
                                     "3775513231",
                                     "3750612709",
                                     "3774826484",
                                     "3665548194",
                                     "3360392628",
                                     "3399645148",
                                     "3413150945",
                                     "3747202678",
                                     "3763470184",
                                     "3775407541",
                                     "3739256322",
                                     "2864373983",
                                     "3662273535",
                                     "3784677588",
                                     "3781486512",
                                     "3628736763",
                                     "3577903007",
                                     "3778511497",
                                     "3785740658",
                                     "3041122351",
                                     "3418252689",
                                     "2870394916",
                                     "2886832936",
                                     "3658499522",
                                     "3110913021",
                                     "2409333430",
                                     "3088951320",
                                     "3315443103",
                                     "2873948227",
                                     "3780696417",
                                     "2447729538",
                                     "3536052310",
                                     "3508537032",
                                     "3502080466",
                                     "3783535220",
                                     "3760534563",
                                     "3490188370",
                                     "3781225795",
                                     "2849455153",
                                     "3685499657",
                                     "3461415167",
                                     "3077900375",
                                     "2881764317",
                                     "3252451158",
                                     "2896041179",
                                     "2366717227"
                                 ],
                     "modIds":  [
                                    "ZombieBuddy",
                                    "KahluaObjectPoolConcurrencyFix",
                                    "ETO_P",
                                    "42Grapeseed",
                                    "ArcadiaRVInterior_B42_MP",
                                    "Authentic Z - Current",
                                    "LiuDing_Tiles",
                                    "Roccos_Tiles",
                                    "Begonia_Town",
                                    "BlackpineCounty",
                                    "CamdenCountyB42",